{
  "$schema": "https://json-schema.org/draft/2020-12/schema",
  "$id": "crinkl://protocol/schemas/store_entry_v1",
  "title": "StoreEntryV1",
  "type": "object",
  "additionalProperties": true,
  "required": ["storeId", "displayName"],
  "properties": {
    "storeId": { "type": "string", "minLength": 1 },
    "displayName": { "type": "string", "minLength": 1 },
    "logo": {
      "type": "object",
      "additionalProperties": true,
      "required": ["uri"],
      "properties": {
        "uri": { "type": "string", "minLength": 1 },
        "contentHash": { "type": "string", "minLength": 1 },
        "mimeType": { "type": "string", "minLength": 1 }
      }
    },
    "brandKey": { "type": "string", "minLength": 1 },
    "categories": {
      "type": "array",
      "items": { "type": "string", "minLength": 1 }
    },
    "externalIds": {
      "type": "array",
      "items": {
        "type": "object",
        "additionalProperties": true,
        "required": ["namespace", "type", "value"],
        "properties": {
          "namespace": { "type": "string", "minLength": 1 },
          "type": { "type": "string", "minLength": 1 },
          "value": { "type": "string", "minLength": 1 }
        }
      }
    },
    "aliases": {
      "type": "array",
      "items": { "type": "string", "minLength": 1 }
    },
    "status": { "type": "string", "enum": ["ACTIVE", "DEPRECATED"] }
  }
}
